{
  "case_id": "case_015",
  "label": "medium-signal science fair failure",
  "difficulty": "medium",
  "tags": [
    "messy_notes",
    "school_sensitive",
    "resume_list"
  ],
  "student_profile": {
    "grade_level": "12",
    "intended_majors": [
      "psychology"
    ],
    "core_interests": [
      "community",
      "learning",
      "growth"
    ],
    "identity_notes": []
  },
  "essay_project": {
    "project_id": "eval_case_015",
    "project_type": "personal_statement",
    "target_school": "School 3"
  },
  "story_entries": [
    {
      "id": "story_15_1",
      "text": "Case 15: science fair failure. I initially handled this situation poorly, then adapted my approach after feedback. I can point to one turning-point moment and a specific behavior change that affected others."
    }
  ],
  "current_draft": {
    "id": null,
    "text": null
  },
  "school_context": {
    "target_school": "School 3",
    "notes": "Student is considering fit with School 3."
  },
  "expected_conditions": {
    "should_be_needs_more_input": false,
    "should_have_clear_winner": true,
    "likely_bad_baseline_behavior": [
      "generic_praise",
      "flat_options",
      "resume_list_regurgitation"
    ]
  },
  "author_notes": {
    "why_included": "Covers medium difficulty behavior and science fair failure signal pattern.",
    "reviewer_warning": ""
  }
}